Trump	2016-04-26 10:42:39	The Cruz-Kasich pact is under great strain. This joke of a deal is falling apart, not being honored and almost dead. Very dumb!
Staff	2016-04-26 01:52:16	Thank you Wilkes-Barre, Pennsylvania!  #MakeAmericaGreatAgain #Trump2016  https://t.co/FJbNlidwJF
Staff	2016-04-25 22:11:06	Passing what was once a vibrant manufacturing area in Pennsylvania. So sad! #MakeAmericaGreatAgain https://t.co/RYWjgPh9Ja
Staff	2016-04-25 22:06:26	Thank you West Chester, Pennsylvania! #PAPrimary #VoteTrump https://t.co/Qva1QtmhpS https://t.co/CF9SYBqka7
Staff	2016-04-25 21:54:55	Thank you Warwick, Rhode Island! #RIPrimary #VoteTrump  https://t.co/V0d4CuS1xf https://t.co/GU3p28VMe0
Trump	2016-04-25 11:54:21	Lyin' Ted Cruz and 1 for 38 Kasich are unable to beat me on their own so they have to team up (collusion) in a two on one. Shows weakness!
Trump	2016-04-25 03:49:17	Lyin' Ted and Kasich are mathematically dead and totally desperate. Their donors &amp; special interest groups are not happy with them. Sad!
Trump	2016-04-25 03:39:58	Wow, just announced that Lyin' Ted and Kasich are going to collude in order to keep me from getting the Republican nomination. DESPERATION!
Trump	2016-04-25 01:27:12	I am happy to hear how badly the @nytimes is doing. It is a seriously failing paper with readership which is way down. Becoming irrelevant!
Trump	2016-04-24 14:05:43	"@DiamondandSilk: .@DonaldJTrumpJr awesome job on @CNNSotu. DonaldTrump has integrity &amp; he refuses 2 play the game call "Delegate Bribery"
Trump	2016-04-24 14:03:48	"@newtgingrich: #NYPrimary turned Trump from frontrunner into presumptive #GOP nominee https://t.co/oLC7mGgnZ9 https://t.co/iNolBfFFRF"
Trump	2016-04-24 14:01:37	I will be in Maryland this afternoon for a major rally. Things are looking good for Tuesday!
Trump	2016-04-24 13:58:53	.@AndreBauer  Great job and advice on @CNN  @jaketapper  Thank you!
Trump	2016-04-24 02:01:25	.@Borisep was great on @JudgeJeanine tonight. Very smart commentary that will prove to be correct!
Trump	2016-04-24 01:48:17	As soon as John Kasich is hit with negative ads, he will drop like a rock in the polls against Crooked Hillary Clinton. I will win!
Trump	2016-04-24 01:41:57	I had a great day campaigning in Connecticut. Looking for a big vote on Tuesday!
Trump	2016-04-24 00:55:43	Congratulations to @seanhannity on his great ratings and ratings increase as reported by the @AP today. Amazing job!
Staff	2016-04-23 20:29:50	Lynne Ryan -- just read your great story in the NY Times -- I am proud of you. Thanks! https://t.co/zVmhYsd4ir
Staff	2016-04-23 19:30:58	Thank you Delaware! #Trump2016  #MakeAmericaGreatAgain #TrumpTrain https://t.co/qLXTzQPbEj https://t.co/ofhbM9bcOI
Staff	2016-04-23 19:27:18	Thank you Bridgeport, Connecticut! #MakeAmericaGreatAgain #Trump2016 https://t.co/GCtTKnNq06 https://t.co/qcuDCyBzCN
Staff	2016-04-23 16:10:15	Thank you Waterbury, Connecticut! #MakeAmericaGreatAgain #Trump2016 https://t.co/5eZ5nVQbE9 https://t.co/OoQAAKWUUq
Staff	2016-04-23 14:44:49	#MakeAmericaGreatAgain Video: https://t.co/Dsa2v9X3ol https://t.co/aGUHmO98Xm
Trump	2016-04-23 12:37:16	Will be spending the day campaigning in Connecticut, another state where jobs are being stolen by other countries. I will stop this fast!
Staff	2016-04-23 01:17:58	Thank you Pennsylvania! #Trump2016 https://t.co/Y3UBsxBQmg https://t.co/ie23QdsVTe
Staff	2016-04-23 00:03:07	Thank you Indiana! Was great seeing everyone on Wednesday! I will be back soon! #Trump2016 https://t.co/mWfLxYKPbk https://t.co/62DKEm5XVm
Staff	2016-04-22 23:33:20	Thank you California! See you soon! #MakeAmericaGreatAgain #Trump2016 https://t.co/uJCqbQYYWR https://t.co/8rqI4mQ3Tw
Staff	2016-04-22 22:21:03	Thank you, @DonaldJTrumpJr! #Trump2016 #MakeAmericaGreatAgain  https://t.co/FJXjkZAAQf https://t.co/0NQLzbwuFo
Staff	2016-04-22 17:35:37	Thank you for the incredible support, Maryland! This is a movement! #MakeAmericaGreatAgain #Trump2016 https://t.co/Uyq4sTYb0l
Staff	2016-04-22 15:00:11	I met Prince on numerous occasions. He was an amazing talent and wonderful guy. He will be greatly missed!
Staff	2016-04-21 22:16:27	Cruz said Kasich should leave because he couldn't get to 1237. Now he can't get to 1237. Drop out LYIN' Ted.
Trump	2016-04-21 10:22:03	Senator Ted Cruz has been MATHEMATICALLY ELIMINATED from race. He said Kasich should get out for same reason. I think both should get out!
Trump	2016-04-21 10:14:48	I will be doing the @TODAYshow with my wife, Melania, and the rest of my family in a major Town Hall. Hopefully, it will be fun! Enjoy.7A.M.
Staff	2016-04-21 02:26:19	Thank you Maryland- what a great way to conclude the day! Will be back soon. #Trump2016 https://t.co/dNeTdMENdV https://t.co/JbJYYpEsmo
Staff	2016-04-21 01:58:17	Had a meeting with the terrific @GovPenceIN of Indiana. So excited to campaign in his wonderful state! https://t.co/73uCyV6ql4
Staff	2016-04-20 22:50:04	Thank you Indiana! Will be back soon! #Trump2016 #MakeAmericaGreatAgain https://t.co/pxvSL8cs3B
Staff	2016-04-20 15:03:10	Off to Indiana! #Trump2016 https://t.co/zqUdaaSaXD
Trump	2016-04-20 12:42:59	Ted Cruz is mathematically out of winning the race. Now all he can do is be a spoiler, never a nice thing to do. I will beat Hillary!
Trump	2016-04-20 03:31:23	"@bigop1: @realDonaldTrump @CNN @oreillyfactor https://t.co/vXiQru6HIE"  Wow, really nice!
Trump	2016-04-20 03:22:19	Thank you New York, I will never forget!
Trump	2016-04-20 00:54:52	.@CNN is so negative it is impossible to watch. Terrible panel, angry haters. Bill O  @oreillyfactor said such an amazing thing about me!
Trump	2016-04-20 00:03:37	"@GreenSkyDeb: Look everybody, DonaldTrump will win it on the first ballot so keep praying!!! #TrumpTrain #Trump2016 #MakeAmericaGreatAgain"
Trump	2016-04-19 23:51:21	"@keksec__org: @realDonaldTrump Your policies will make this state and country great again! #MakeAmericaGreatAgain https://t.co/SWxV3YCbqb"
Trump	2016-04-19 23:50:09	"@kdk144: @realDonaldTrump Everybody is "In A New York State of Mind" now!"
Trump	2016-04-16 12:00:26	I will be interviewed on @foxandfriends at 9:00 A.M. I will be talking about the rigged and boss controlled Republican primaries!
Trump	2016-04-16 11:56:11	"@dmharvey89: @realDonaldTrump @wdct8110 I just voted for @realDonaldTrump in Indiana. Everyone I talk to was following suit!" Fantastic!
Trump	2016-04-16 01:17:55	"@herb_stamper: @JackoffJosh711 @SenFrankNiceley @FoxNews @WSJ we are becoming a third world country because of jerks like him" Great!
Trump	2016-04-16 01:15:29	"@wdct8110: @realDonaldTrump We love you Donald ! Finally someone who actually cares about us .. !! https://t.co/BKoQu1mm4A"
Trump	2016-04-16 01:14:26	"@Bubble709_: @realDonaldTrump Praying for your family and your win in New York." Thank you!
Staff	2016-04-16 00:59:09	Join me this weekend! #NYPrimary 4/16: SYRACUSE - NOON https://t.co/Eu43S1wJN9 4/16: WATERTOWN - 3pm https://t.co/UdOZzisJhA  #Trump2016
Staff	2016-04-15 21:52:38	Thank you, @NYPost! #Trump2016 https://t.co/KzGweIxaEo
Staff	2016-04-15 21:12:00	Thank you America! #Trump2016 https://t.co/PTKkrLeuCB
Staff	2016-04-15 03:50:37	MAKE AMERICA GREAT AGAIN! https://t.co/VxVOG3c5RZ
Staff	2016-04-14 17:55:23	Join me on Saturday- in Syracuse, New York! #NYPrimary #Trump2016 https://t.co/F6JkPKb1hn https://t.co/yfJZUlDdCM
Trump	2016-04-14 04:11:46	Big protest march in Colorado on Friday afternoon! Don't let the bosses take your vote!
Trump	2016-04-14 03:53:59	The rules DID CHANGE in Colorado shortly after I entered the race in June because the pols and their bosses knew I would win with the voters
Trump	2016-04-14 03:46:29	Biggest story in politics is now happening in the great State of Colorado where over one million people have been precluded from voting!
Staff	2016-04-14 01:06:25	Will be interviewed by @SeanHannity on @FoxNews tonight at 10pm from Pennsylvania. Enjoy! #Trump2016 https://t.co/8IJ40zKS90
Staff	2016-04-13 13:48:43	Join me in Pittsburgh- tonight at 7pmE! #Trump2016 #TrumpTrain Tickets: https://t.co/TrKj5lGXup
Staff	2016-04-13 05:11:41	#MakeAmericaGreatAgain #Trump2016 https://t.co/249n3yLQxS
Staff	2016-04-13 05:10:07	#MakeAmericaGreatAgain #Trump2016  https://t.co/l5TyL8U4e8
Trump	2016-04-13 03:53:39	Great to be on @andersoncooper tonight with my wonderful family. Will be rebroadcast at 12:00 A.M.  (EASTERN).
Staff	2016-04-12 22:15:28	I LOVE NEW YORK! #NewYorkValues  https://t.co/dbTDhYAX1v
Staff	2016-04-12 16:10:23	THANK YOU California, Maryland, New York, and Pennsylvania! See you soon! #MakeAmericaGreatAgain #Trump2016 https://t.co/2lyqnMRIGq
Staff	2016-04-12 16:02:54	Missouri just confirmed #Trump2016 as the official winner- with an additional 12 delegates. #MakeAmericaGreatAgain https://t.co/AVTkCAne5w
Staff	2016-04-12 10:13:02	WOW, great new poll- New York! Thank you for your support! #Trump2016 #NewYorkValues https://t.co/kuvCXJXjcr https://t.co/WSVmdI8vfZ
Staff	2016-04-12 01:31:23	Thank you Albany, New York! #MakeAmericaGreatAgain #Trump2016 https://t.co/IAOuSY5VDC https://t.co/WcItUuxej8
Staff	2016-04-11 23:02:54	Join me in Rome, NY- tomorrow! #Trump2016 #NYPrimary Tickets available: https://t.co/VGCdQubia1
Staff	2016-04-11 22:49:25	Tune in &amp; join me live in Albany, New York! 7pmE start time! I love you New York! #Trump2016 #TrumpTrain  https://t.co/rY5zqUX9Wu
Staff	2016-04-11 22:07:39	A very interesting piece, by a very good writer, @KirstenPowers of @USATODAY and @FoxNews. https://t.co/gLuMitRitg
Staff	2016-04-11 20:58:59	Leaving for Albany, New York now, massive crowd expected. Very exciting!
Staff	2016-04-11 20:58:42	Why does the liberal media think Bill O'Reilly  (@oreillyfactor) is a complete and total vulgarian? I don't think so!
Trump	2016-04-11 12:21:11	"@AnnesLimo: @realDonaldTrump @WVTTS1017 Thanks for Rochester rally."  Great people, thank you!
Trump	2016-04-11 11:18:43	"@WVTTS1017: @realDonaldTrump just listened to you on fox. I love you so much."  Thank you!
Trump	2016-04-11 11:18:17	"@autoprofessor17: @realDonaldTrump Great job on Fox n Friends this morning. Very well spoken and presidential. #TrumpTrain"
Trump	2016-04-11 11:17:16	"@TimeHasCome1: @WayneDupreeShow @ThePatriot143 Trump needs to hold a massive protest rally in Colorado. He'd get 100k &amp; own the news cycle"
Trump	2016-04-11 10:45:01	I will be interviewed on @foxandfriends at 7:00 A.M. Enjoy!
Trump	2016-04-11 00:50:56	The people of Colorado had their vote taken away from them by the phony politicians. Biggest story in politics. This will not be allowed!
Trump	2016-04-11 00:28:54	How is it possible that the people of the great State of Colorado never got to vote in the Republican Primary? Great anger - totally unfair!
Trump	2016-04-10 13:47:57	I win a state in votes and then get non-representative delegates because they are offered all sorts of goodies by Cruz campaign. Bad system!
Trump	2016-04-10 13:40:23	The @nytimes purposely covers me so inaccurately. I want other nations to pay the U.S. for our defense of them. We are the suckers-no more!
Trump	2016-04-10 11:29:49	"@agentvf: New Jersey Man Joseph Hornick Willing to Go to Jail for Flying Trump Flag - Breitbart https://t.co/zky3vlOJu4  @Q102Philly"
Trump	2016-04-10 11:25:38	"@getreal1234: @realDonaldTrump @Kids123Nicholas @gqforbes @RepTomMarino let's go Pa he has my vote Go Trump"
Trump	2016-04-10 03:17:30	"@jlopez05391: @realDonaldTrump Rochester loves you! See you tomorrow! #MakeAmericaGreatAgain #Trump2016 #TrumpTrain" A big crowd!
Trump	2016-04-10 03:10:16	"@becker_berta: @vivhall3 @Reince Millions more will burn their Republican registration if GOP continues to subvert the will of the people."
Trump	2016-04-10 03:05:28	"@metalmom888:  @Theresa_Cali If the GOP screws Trump, his millions will walk from the GOP never to return! They better think long and hard"
Trump	2016-04-10 03:04:56	"@AnnCoulter: GOP is trying to steal nomination from the winner (Trump) not block an insurgent catching up 2 frontrunner (Sanders).
Trump	2016-04-10 03:02:59	"@governor_savage: @realDonaldTrump is the only person who can save us from this corrupt political mess. #MakeAmericaGreatAgain"
Trump	2016-04-10 03:02:23	"@Mutual408Grace: @realDonaldTrump @gene70 California women love Mr Trump too. Will make it happen in New York on April 19. Go out &amp; vote."
Trump	2016-04-10 03:00:04	"@Kids123Nicholas: @gqforbes  @RepTomMarino @realDonaldTrump.Lets get it done Philadelphia Pa.Make Trump your pick for president now.
Trump	2016-04-10 02:47:20	"@PennyHicks13: @Carolde @kisster1 @FoxNews   Your tax and economic plans are second to none! https://t.co/Q08Kp4esxl Media shld report.
Trump	2016-04-10 02:45:46	"@Theresa_Cali: Poll shows @realDonaldTrump leads among registered Republican women with 44%. ���� https://t.co/yQmh3iSPBY" Thank you!
Trump	2016-04-10 02:44:11	"@vivhall3: @realDonaldTrump here your delegate replaced at CO GOP convention. https://t.co/NxYhzdcMS0" Very sad!
Trump	2016-04-09 12:02:59	"@gene70: @realDonaldTrump The Real Person Of The Year! https://t.co/3yFUZALNVn"  Wow!
Trump	2016-04-09 11:44:24	"@gene70: @realDonaldTrump Fugedaboudit!!! The woman in New York love Donald Trump!!! https://t.co/ZcfT90hGEX"
Trump	2016-04-09 11:22:32	Bernie Sanders says that Hillary Clinton is unqualified to be president. Based on her decision making ability, I can go along with that!
Trump	2016-04-09 03:07:00	Isn't it a shame that the person who will have by far the most delegates and many millions more votes than anyone else, me, still must fight
Trump	2016-04-09 02:58:52	"@DnGLax:  Yes! Thank U 4 coming to LI! It was a thrill 2 B part of it! U will get the job done! #MakeAmericaGreatAgain #trump2016 ����"
Trump	2016-04-09 02:52:33	"@AlexNightrasor: @realDonaldTrump @lilrachiepoo Trump will be our best president since Reagan!
Trump	2016-04-09 02:35:06	"@lilrachiepoo: @realDonaldTrump Thank you, Mr. Trump, for your personal and financial sacrifices in this journey to #MAKEAMERICAGREATAGAIN"
Trump	2016-04-09 02:33:07	"@RepaloneLori: @realDonaldTrump @kirstiealley we love you and know you will do an awesome job! Saw you in bethpage !! ������" Thank you.
Trump	2016-04-09 02:32:07	"@redneckgp: All you haters out there, STOP trashing the only candidate @realDonaldTrump that will put ALL OF YOU &amp; AMERICA FIRST  #trump"
Trump	2016-04-09 02:28:16	"@RepMartinDaniel: We support you #HaileyPuckett. You will go far in life. Smart and courageous!
Trump	2016-04-04 03:13:47	A great day in Wisconsin, many stops, many great people! Melania is joining me on Monday. Big crowds. MAKE AMERICA GREAT AGAIN!
Staff	2016-04-04 02:16:34	A great night in West Allis, Wisconsin! Thank you! #VoteTrumpWI #WIPrimary  https://t.co/4x9gw1RhWS https://t.co/syGyqtOebs
Staff	2016-04-04 00:14:13	I am on @FoxNews with @greta doing a town hall, from Wisconsin- now! Enjoy! #MakeAmericaGreatAgain #Trump2016
Staff	2016-04-03 23:48:11	Congratulations to @gohermie for winning the @ShellHouOpen. We are all proud of you @TNGCBedminster &amp; all @TrumpGolf clubs! Great going!
Staff	2016-04-03 20:43:32	I will be in Milwaukee, Wisconsin- tomorrow at 7pmE with @MELANIATRUMP. Join us! #WIPrimary #Trump2016 https://t.co/L0PmEwdRxn
Staff	2016-04-03 18:05:32	Thank you Miss Katie's Diner! #MakeAmericaGreatAgain #Trump2016 https://t.co/oYpUYJmpKI https://t.co/uTSIiVqPkT
Staff	2016-04-03 17:48:16	Thank you New York, and Pennsylvania!  #MakeAmericaGreatAgain #Trump2016 https://t.co/sziCGsvGbz
Trump	2016-04-03 14:53:01	"@GOPjenna: "I don't care about the game, I care about the PEOPLE." And that's exactly why WE THE PEOPLE love you so much! #Trump2016"
Staff	2016-04-03 13:46:39	Thank you! #Trump2016 #WIPrimary https://t.co/alx0AY6E8J
Trump	2016-04-03 13:41:27	"@007cigarjoe: #MakeAmericaGreatAgain #Trump2016 @realDonaldTrump IS THE ONLY DEAL !!! https://t.co/PQHIM7AbvK"
Trump	2016-04-03 13:40:39	"@Margee11: #WISCONSIN VOTE SMART @tedcruz RECORDS R SEALED.. WHAT IS HE HIDING? SAVE AMERICA W/ @realDonaldTrump https://t.co/kMuAoGF99S"
Trump	2016-04-03 13:37:37	"@Wheels155:@CNN is reviewing the week,but majority of the show about @realDonaldTrump cuz there would be 0.0 ratings if not. Media's a JOKE
Trump	2016-04-03 12:16:28	I will be on @FoxNewsSunday with Chris Wallace this morning. Enjoy!
Staff	2016-04-03 03:15:09	Thank you Eau Claire, Wisconsin.  #VoteTrump on Tuesday, April 5th! MAKE AMERICA GREAT AGAIN! https://t.co/JI5JqwHnMC
Staff	2016-04-03 03:09:48	I will be interviewed by @jdickerson on @FaceTheNation tomorrow morning. Enjoy! #Trump2016
Staff	2016-04-02 23:51:08	A GREAT DAY IN WISCONSIN! Thank you #Racine &amp; #Wausau! Just arrived in #EauClaire! #Trump2016 #WIPrimary #TrumpTrain https://t.co/a0iKqNepD5
Staff	2016-04-02 20:31:12	.@FoxNews should be ashamed for allowing experts to explain how to make a nuclear attack!
Staff	2016-04-02 20:30:25	.@HeyTammyBruce- Thank you for your nice words on Fox today. They never use my full statements on nuclear, which you would agree with!
Staff	2016-04-02 20:19:05	Great honor to have @GOP General Counsel, #JohnRyder as a Trump delegate in TN. RNC meeting well worth it! Unifying the party!
Staff	2016-04-02 19:18:14	Join me on Monday, April 4th in Milwaukee! #WIPrimary #Trump2016 Tickets: https://t.co/L0PmEwdRxn https://t.co/F7P4s6oAzN
Trump	2016-04-02 02:21:56	I will be in Wisconsin until the election. Jobs, trade and immigration will be big factors. I will bring jobs back home - make great deals!
Trump	2016-04-02 02:09:29	If @megynkelly stopped covering me on her show, her ratings would drop like a rock! My h to h interview with @AC360 beat her by millions!
Staff	2016-04-01 22:36:39	MAKE AMERICA GREAT AGAIN!  https://t.co/SULeDE2PYp
Staff	2016-04-01 19:12:58	My new radio ad, airing today in Wisconsin! See you soon! #WIPrimary #Trump2016  https://t.co/iEbcYqyk3i
Trump	2016-04-01 04:29:49	The Club For Growth said in their ad that 465 delegates (Cruz) plus 143 delegates (Kasich) is more than my 739 delegates. Try again!
Trump	2016-04-01 04:23:25	The Club For Growth,which asked me for $1,000,000 in an extortion attempt, just put up a Wisconsin ad with incorrect math.What a dumb group!
Staff	2016-04-01 02:21:02	#MakeAmericaGreatAgain #Trump2016 https://t.co/aANxirUJJD https://t.co/VlMynYN3sd
Staff	2016-03-31 22:33:09	THANK YOU, NEW YORK! #Trump2016 https://t.co/ONDROBrDwr
Staff	2016-03-31 20:27:40	THANK YOU, WISCONSIN! #VoteTrump  next Tuesday, April 5th! #WIPrimary https://t.co/4tymy651ZP https://t.co/IOBhOXeBiN
Staff	2016-03-31 19:05:59	Just had a very nice meeting with @Reince Priebus and the @GOP. Looking forward to bringing the Party  together --- and it will happen!
Staff	2016-03-31 13:48:20	The Trump Doctrine: Peace Through Strength. #Trump2016  https://t.co/2GD1TT8fXc https://t.co/tr1ILOoLUb
Trump	2016-03-31 02:57:50	"@susanbirchfiel1: Nothing you say will change my mind! Woman for @realDonaldTrump https://t.co/MIq1iF2097"
Trump	2016-03-31 02:47:51	"@Gearssuxs: @loudobbsnews @realDonaldTrump I'm a democrat and switch over to republican just to vote for trump in the primary."  Great!
Staff	2016-03-30 21:35:14	Thank you- Appleton, Wisconsin! #WIPrimary #Trump2016  https://t.co/XkbTWHpEvy https://t.co/klUNUV2J5S
Staff	2016-03-30 21:17:43	Congratulations to @CNN for having the wisdom to pick TRUMP! #MakeAmericaGreatAgain #Trump2016 https://t.co/Up8DhQulZ4
Staff	2016-03-30 17:05:51	Please keep your thoughts &amp; prayers with Melissa Young- Miss Wisconsin 2005. https://t.co/D8RBfufIwH
Staff	2016-03-30 16:35:57	THANK YOU, NEW YORK! #MakeAmericaGreatAgain #Trump2016 https://t.co/PuqiM93zOS https://t.co/fSgpKjwk2q
Staff	2016-03-30 03:10:20	.@DavidGregory got thrown off of TV by NBC, fired like a dog! Now he is on @CNN being nasty to me. Not nice!
Staff	2016-03-30 00:07:20	Final #'s just announced in the GREAT State of MO. TRUMP WINS! New certified #'s show a 365 vote increase for me- @ least 12 more delegates!
Staff	2016-03-29 21:25:44	Thank you! #Trump2016 https://t.co/ZWZkHrtRQN
Staff	2016-03-29 21:19:56	Trump defends campaign manager charged for bruising a reporter: https://t.co/EKU5QMgjd4
Staff	2016-03-29 20:24:25	Thank you! #MakeAmericaGreatAgain https://t.co/sVUWI7JoGn
Staff	2016-03-29 19:38:03	MAKE AMERICA GREAT AGAIN! https://t.co/0w4ldD7dW3
Staff	2016-03-29 19:35:20	Why is this reporter touching me as I leave news conference? What is in her hand?? https://t.co/HQB8dl0fhn
Staff	2016-03-29 19:18:53	This was the reporters statement- when she found out there was tape from my facility, she changed her tune. https://t.co/N5815RS1At
Staff	2016-03-29 19:05:15	Victory press conference was over.  Why is she allowed to grab me and shout questions? Can I press charges? https://t.co/qbW2RjkINX
Trump	2016-03-29 16:44:36	Why aren't people looking at this reporters earliest statement as to what happened, that is before she found out the episode was on tape?
Trump	2016-03-29 14:45:37	How come the @TODAYshow &amp; @chucktodd show the new @NBCNews Poll for Hillary vs Bernie but do not show the SAME poll where I am killing Cruz?
Trump	2016-03-29 13:34:36	Wow, @CNN has nothing but my opponents on their shows. Really one-sided and unfair reporting. Maybe I shouldn't do their town-hall tonight!
Trump	2016-03-29 01:07:23	We need to secure our borders ASAP. No games, we must be smart, tough and vigilant. MAKE AMERICA GREAT AGAIN &amp; MAKE AMERICA STRONG AGAIN!
Trump	2016-03-24 15:59:13	"@NeilTurner_: @realDonaldTrump Cruz &amp; Rubio are scared! WATCH -&gt; https://t.co/pWjLW1QBKo https://t.co/W2r6mOzgkb"
Trump	2016-03-24 15:55:32	Europe and the U.S. must immediately stop taking in people from Syria. This will be the destruction of civilization as we know it! So sad!
Trump	2016-03-24 15:52:11	Just announced that as many as 5000 ISIS fighters have infiltrated Europe. Also, many in U.S.  I TOLD YOU SO! I alone can fix this problem!
Trump	2016-03-24 15:49:02	"@Doctor_S_Freud:  @TheView They're all brain-dead puppets with skeletons in their closet. I say you go on and destroy them all" A dead show
Trump	2016-03-24 15:39:16	Explain how the women on The View, which is a total disaster since the great Barbara Walters left, ever got their jobs. @abc is wasting time
Trump	2016-03-24 15:33:34	.@TheView T.V. show, which is failing so badly that it will soon be taken off thr air, is constantly asking me to go on. I TELL THEM "NO"
Trump	2016-03-24 14:46:29	Hillary Clinton has been working on solving the terrorism problem for years. TIME FOR A CHANGE, I WILL SOLVE - AND FAST!
Trump	2016-03-24 14:41:46	"@TimVincent56:  @LindseyGrahamSC Talkers think about the future, Doers are already building it" #VoteTrump2016 https://t.co/OoB38jypsD"
Trump	2016-03-24 14:38:13	It is amazing how often I am right, only to be criticized by the media. Illegal immigration, take the oil, build the wall, Muslims, NATO!
Trump	2016-03-24 14:17:57	Remember when I recently said that Brussels is a "hell hole" and a mess and the failing @nytimes wrote a critical article. I was so right!
Staff	2016-03-24 14:14:14	These politicians like Cruz and Graham, who have watched ISIS and many other problems develop for years, do nothing to make things better!
Trump	2016-03-24 14:07:07	.@LindseyGrahamSC and Lyin' Ted Cruz are two politicians who are very much alike - ALL TALK AND NO ACTION! Both talk about ISIS, do nothing!
Trump	2016-03-24 14:02:27	It is amazing how @LindseyGrahamSC gets on so many T.V. shows talking negatively about me when I beat him so badly (ZERO) in his pres run!
Trump	2016-03-24 13:40:26	"@missi51: .@realDonaldTrump thank God is not a politician, but he's one heck of a fighter who will fight for us, the people."
Trump	2016-03-24 11:59:06	We pay a disproportionate share of the cost of N.A.T.O. Why? It is time to renegotiate, and the time is now!
Trump	2016-03-24 11:47:26	N.A.T.O. is obsolete and must be changed to additionally focus on terrorism as well as some of the things it is currently focused on!
Trump	2016-03-24 03:55:00	"@Don_Vito_08: "A picture is worth a thousand words" @realDonaldTrump  #LyingTed #NeverCruz  @MELANIATRUMP https://t.co/5bvVEwMVF8"
Trump	2016-03-24 03:35:21	"@Kj11100Me: @realDonaldTrump Donald Trump will be greater  president than Ragan. Trump will set the button for morality,Christianity.
Trump	2016-03-24 03:03:33	"@tcsorr: @jphilman0206 @realDonaldTrump self-funded and media loves him. Not beholden to masters like @tedcruz. Who owns Ted?"
Trump	2016-03-23 23:25:00	MAKE AMERICA GREAT AGAIN!
Trump	2016-03-23 21:44:44	I want to thank @RealSheriffJoe for all of his help in our historic Arizona win. Could not have done it without you Joe!
Trump	2016-03-23 21:12:54	While I believe I will clinch before Cleveland and get more than 1237 delegates, it is unfair in that there have been so many in the race!
Trump	2016-03-23 20:02:29	I think having Jeb's endorsement hurts Lyin' Ted. Jeb spent more than $150,000,000 and got nothing. I spent a fraction of that and am first!
Trump	2016-03-23 14:22:51	Lyin' Ted Cruz denied that he had anything to do with the G.Q. model photo post of Melania. That's why we call him Lyin' Ted!
Trump	2016-03-23 04:04:34	Hopefully the Republican Party can come together and have a big WIN in November, paving the way for many great Supreme Court Justices!
Trump	2016-03-23 03:43:50	Much bigger win than anticipated in Arizona. Thank you, I will never forget!
Staff	2016-03-23 03:30:10	Thank you, Arizona! #Trump2016 #WesternTuesday #TrumpTrain https://t.co/VMCzxrryG8
Trump	2016-03-23 02:59:29	Incompetent Hillary, despite the horrible attack in Brussels today, wants borders to be weak and open-and let the Muslims flow in.  No way!
Trump	2016-03-23 01:53:05	Lyin' Ted Cruz just used a picture of Melania from a G.Q. shoot in his ad. Be careful, Lyin' Ted, or I will spill the beans on your wife!
Staff	2016-03-22 22:41:46	Pres. Obama should leave the baseball game in Cuba immediately &amp; get home to Washington- where a #POTUS, under a serious emergency belongs!
