Staff	2016-05-27 17:35:56	Bill O'Reilly doing a major special on @OreillyFactor tonight- @FoxNews at 8pmE. Watch it, should be good! #Trump2016
Staff	2016-05-27 14:10:07	AN AMERICA FIRST ENERGY PLAN #MakeAmericaGreatAgain #Trump2016 https://t.co/kTi6e1zyNI https://t.co/WjI8Rx11no
Trump	2016-05-27 02:09:03	Poll data shows that @marcorubio does by far the best in holding onto his Senate seat in Florida. Important to keep the MAJORITY. Run Marco!
Staff	2016-05-26 22:22:50	My wife @MELANIATRUMP, and my children will be featured on @FoxNews with @Greta- 7pmE. Enjoy! #MeetTheTrumps #Trump2016
Staff	2016-05-26 21:30:31	Celebrating 1237! #Trump2016  https://t.co/hPQJc7eor0
Staff	2016-05-26 21:28:22	Thank you! #Trump2016 https://t.co/SPJfMFyPjU
Staff	2016-05-26 21:15:16	I find it offensive that Goofy Elizabeth Warren, sometimes referred to as Pocahontas, pretended to be Native American to get in Harvard.
Staff	2016-05-26 18:59:12	Thank you Mr. &amp; Mrs. @TomBarrackJr for the wonderful and magical evening last night. It will not be forgotten. #Trump2016
Trump	2016-05-26 13:18:27	The Inspector General's report on Crooked Hillary Clinton is a disaster. Such bad judgement and temperament cannot be allowed in the W.H.
Staff	2016-05-25 23:18:54	Thank you Anaheim, California! #Trump2016 https://t.co/AEShamhNVS
Staff	2016-05-25 18:42:55	Thank you Washington! Honored to say, on behalf of our great movement, we have broken the all time record for votes in GOP primary history.
Trump	2016-05-25 13:39:38	The protesters in New Mexico were thugs who were flying the Mexican flag. The rally inside was big and beautiful, but outside, criminals!
Trump	2016-05-25 13:14:58	Crooked Hillary Clinton just can't close the deal with Bernie. I had to knock out 16 very good and smart candidates. Hillary doesn't have it
Trump	2016-05-25 12:31:56	Goofy Senator Elizabeth Warren @elizabethforma has done less in the U.S. Senate than practically any other senator. All talk, no action!
Trump	2016-05-25 05:47:45	"@gordonsr1052:  Washington, BIG Thank You for supporting Trump! We are all going to help Trump Make America Great Again! Trump2016!"
Trump	2016-05-25 05:45:19	"@buiIdthewall: @realDonaldTrump high energy!"
Trump	2016-05-25 05:45:11	"@PiperSul: Great speech tonight Mr.Trump! Good Luck in California! Thank you.
Staff	2016-05-22 22:54:48	Thank you America! #Trump2016 https://t.co/xfINxdRNiQ
Trump	2016-05-22 20:44:48	The American people are sick and tired of not being able to lead normal lives and to constantly be on the lookout for terror and terrorists!
Staff	2016-05-22 19:46:57	Join me on Wednesday, May 25th at the Anaheim Convention Center! #Trump2016 #MAGA  Tickets: https://t.co/mmPck1HYrC https://t.co/xGkVbxTamz
Staff	2016-05-22 19:38:18	Crooked Hillary wants a radical 500% increase in Syrian refugees. We can’t allow this. Time to get smart and protect America!
Staff	2016-05-22 19:37:05	How can Crooked Hillary say she cares about women when she is silent on radical Islam, which horribly oppresses women?
Staff	2016-05-22 14:47:45	Why do the networks continue to put dopey @BillKristol on panels when he has called every single shot about me wrong for 2 yrs?
Trump	2016-05-22 12:47:48	Hillary Clinton is not qualified to be president because her judgement has been proven to be so bad! Would be four more years of stupidity!
Trump	2016-05-22 03:55:39	Crooked Hillary said that I  want guns brought into the school classroom. Wrong!
Staff	2016-05-21 20:13:08	Thank you to all of the men and women who have served our country. You are our true heroes! #ArmedForcesDay https://t.co/A3Wus0cRIO
Staff	2016-05-21 17:02:41	Crooked Hillary Clintons foreign interventions unleashed ISIS in Syria, Iraq and Libya. She is reckless and dangerous!
Staff	2016-05-21 17:00:42	MAKE AMERICA GREAT AGAIN! https://t.co/MAZK5bdZuD
Trump	2016-05-21 16:08:26	.@CNN is so negative, getting even worse as I get closer. Just had two anti-Trump losers with zero rebuttal from my team. Turning off!
Trump	2016-05-21 13:34:02	"@RBacliff: Hillary wants to rip the guns out of America's hands. No guns = no protection. Get on #TrumpTrain &amp; join @NRA to stop her."
Trump	2016-05-21 12:49:59	Crooked Hillary wants to get rid of all guns and yet she is surrounded by bodyguards who are fully armed. No more guns to protect Hillary!
Trump	2016-05-21 10:56:20	While our wonderful president was out playing golf all day, the TSA is falling apart, just like our government! Airports a total disaster!
Trump	2016-05-21 01:56:44	Crooked Hillary is spending tremendous amounts of Wall Street money on false ads against me. She is a very dishonest person!
Trump	2016-05-21 01:51:57	Crooked Hillary Clinton wants to essentially abolish the 2nd Amendment. No gun owner can ever vote for Clinton!
Trump	2016-05-21 00:44:43	Thank you @TheTodaysGolfer for the wonderful statement that "the new par 3 9th hole @Trump Turnberry could be the most dramatic in Britain."
Trump	2016-05-20 23:36:17	@montgomeriefdn  Colin, great to have you at Trump Turnberry. So proud of you and your GREAT playing! You made winning MAJORS look easy!
Trump	2016-05-20 23:27:38	"@montgomeriefdn: @TrumpTurnberry Best Links Course in Britain. Ailsa Course opens June '16 Can't wait to play it https://t.co/HnQbj3ipuS"
Staff	2016-05-20 22:50:18	Thank you for your wonderful endorsement today @TGowdySC. It means a great deal to me. We will not disappoint! #Trump2016
Staff	2016-05-20 21:55:40	Great day in Kentucky with Wayne LaPierre, Chris Cox &amp; the @NRA!  #MakeAmericaGreatAgain #Trump2016 https://t.co/aJ7s0aqqj0
Staff	2016-05-20 20:06:48	Thank you! An honor to be the first candidate ever endorsed by the @NRA- prior to @GOPconvention! #Trump2016 #2A  https://t.co/ygLUAl7gzx
Staff	2016-05-20 16:11:21	Failing @NYTimes will always take a good story about me and make it bad. Every article is unfair and biased. Very sad!
Staff	2016-05-20 16:09:16	Thanks @piersmorgan!  "Trump is the most unpredictable, extraordinary, entertaining&amp;massively popular candidate this country has ever seen."
Staff	2016-05-20 15:36:44	Crooked Hillary Clinton- discussing the #SecondAmendment at a private event. #2A cc: @NRA https://t.co/vV31Pbpkmn
Staff	2016-05-20 15:15:08	I am on my way! See you all soon! https://t.co/Arw19Antpj
Trump	2016-05-20 10:26:20	Crooked Hillary can't even close the deal with Bernie - and the Dems have it rigged in favor of Hillary. Four more years of this? No way!
Trump	2016-05-20 09:58:47	Look where the world is today, a total mess, and ISIS is still running around wild. I can fix it fast, Hillary has no chance!
Trump	2016-05-20 09:47:09	Crooked Hillary has zero imagination and even less stamina. ISIS, China, Russia and all would love for her to be president. 4 more years!
Trump	2016-05-20 09:40:37	I said that Crooked Hillary Clinton is "not qualified" to be president because she has "very bad judgement" - Bernie said the same thing!
Staff	2016-05-19 19:36:58	Thank you @LtStevenLRogers. We will respond to terrorism with strength in 2017! https://t.co/Mk4YuuRf4s
Trump	2016-05-19 10:27:48	Looks like yet another terrorist attack. Airplane departed from Paris. When will we get tough, smart and vigilant? Great hate and sickness!
Trump	2016-05-19 02:52:29	My list of potential U.S. Supreme Court Justices was very well recieved. During the next number of weeks I may be adding to the list!
Trump	2016-05-19 01:54:08	Some low-life journalist claims that I "made a pass" at her 29 years ago. Never happened! Like the @nytimes story which has become a joke!
Staff	2016-05-18 23:14:39	#MakeAmericaGreatAgain #Trump2016 https://t.co/kXhc2j94YF https://t.co/YZAdAndKXv
Staff	2016-05-18 17:47:19	Thank you Louisiana! #Trump2016 https://t.co/u8hhrRRFMp
Staff	2016-05-18 17:38:20	Thank you Arizona! See you soon! #MakeAmericaGreatAgain https://t.co/IC3pe5lRAS
Trump	2016-05-18 04:22:01	Paul Begala, the dopey @CNN flunky and head of the Pro-Hillary Clinton Super PAC, has knowingly committed fraud in his first ad against me.
Trump	2016-05-18 04:03:08	"@ShoneeP: @realDonaldTrump Trump for President! Bernie is a joke, knows nothing - and Hillary is yesterday's and today's nightmare"
Trump	2016-05-18 03:46:26	"@MagicMetalNinja:  The Trump movement will not be stopped. We support Trump because he is a true American looking out for #AmericaFIRST."
Trump	2016-05-18 03:24:48	Congratulations to THE MOVEMENT, we have just won THE GREAT STATE OF OREGON. The vote percentage is even higher than anticipated! Thank you.
Staff	2016-05-18 03:15:07	Thank you Oregon! #Trump2016  #MakeAmericaGreatAgain https://t.co/hK1yqlp9ca
Trump	2016-05-18 02:40:34	"@sandrajeanne48: No way I believe Trump at 70% disapproval with women. Went to 3 rallies. At least 1/2 women. MSM LIES @TheFive"
Trump	2016-05-18 02:14:51	"@michael_favreau: @JIS3 @realDonaldTrump He will destroy Hillary but why give CNN record breaking ratings CNN can go to hell. Trump 2016"
Trump	2016-05-18 01:49:32	I can't believe that @CNN would allow the very nice Jeffrey Lord to be savaged by a panel of seven Trump haters. 7 to 1 - Don't watch CNN!
Trump	2016-05-18 01:37:33	"@COWBOYSFORTRUMP: @ChristiChat @Rockprincess818 @realDonaldTrump That man is a pillar of strength and will be perfect as our next president
Trump	2016-05-18 01:04:23	Well, that is it. Well done Megyn --- and they all lived happily ever after! Now let us all see how "THE MOVEMENT" does in Oregon tonight!
Trump	2016-05-18 00:57:16	Will go back on for a final question now!
Trump	2016-05-18 00:56:35	"@jrector34: @realDonaldTrump Amazing job"
Trump	2016-05-18 00:53:14	I like Michael Douglas!
Trump	2016-05-18 00:48:42	"@thydanielflores: .@megynkelly @realDonaldTrump Best interview that I have ever seen.
Trump	2016-05-18 00:47:51	"@CostaKenneth: @megynkelly @realDonaldTrump Great interview Megyn"
Trump	2016-05-18 00:47:01	"@svhlevi: @DiamondandSilk @realJeffreyLord @realDonaldTrump @CNN and we love you Diamond and Silk"  I do also!
Trump	2016-05-18 00:45:13	"@johnjohnlacca: Donald u have done a terrific job so far on the interview. Cannot wait until u r president #MegynKellyPresents
Trump	2016-05-18 00:43:47	"@markgruber1960: @megynkelly @realDonaldTrump That's why he is so successful. He is driven to succeed"  True!
Trump	2016-05-18 00:43:27	"@ladytsbrug: Lovely interview, Mr. Trump! @realDonaldTrump" Thanks.
Trump	2016-05-18 00:42:29	"@Janik1968: @realDonaldTrump @SpeakerRyan Watched the Megan Kelly special and I must say..it was very well done on both their parts"
Trump	2016-05-18 00:41:23	"@KaceyIlliot1669: @realDonaldTrump We actually really do love you!" Great!
Trump	2016-05-18 00:41:06	"@johnkirtley:  @megynkelly @realDonaldTrump #MakeAmericaGreatAgain Thank you for this discourse. Wounds have been healed. Great job!"
Trump	2016-05-18 00:40:41	"@jlund04: @megynkelly @realDonaldTrump it was refreshing to see you both in a different light. Well done."
Trump	2016-05-18 00:37:13	"@FrankDallasAgg: @megynkelly @realDonaldTrump Trump is a great man and is FIGHTING for We The People!"
Trump	2016-05-18 00:35:40	"@LADYJOANNE: @megynkelly @realDonaldTrump we need Trump more then ever Megyn. Thanks.
Trump	2016-05-18 00:34:55	"@LADYJOANNE: @megynkelly @realDonaldTrump we need Trump more then ever Megan Please don't lose it for America for us!"
Trump	2016-05-18 00:33:40	"@curtandkaren: Kudos to @megynkelly and @realDonaldTrump for rising above the drama and coming together. Very respectful and classy ��"
Trump	2016-05-17 04:02:45	What Barbara Res does not say is that she would call my company endlessly, and for years, trying to come back. I said no.
Trump	2016-05-17 03:46:35	I gave a woman named Barbara Res a top N.Y. construction job, when that was unheard of, and now she is nasty. So much for a nice thank you!
Trump	2016-05-17 01:08:17	"In politics, and in life, ignorance is not a virtue." This is a primary reason that President Obama is the worst president in U.S. history!
Staff	2016-05-16 21:50:40	Rowanne Brewer, the most prominently depicted woman in the failing @nytimes story yesterday joined @foxandfriends.  https://t.co/qkK3LJPoQQ
Trump	2016-05-16 13:24:21	A political commentator for @cnn, which I no longer watch, said "Trump showed some weakness in the Repub Primaries." I set all-time record!
Trump	2016-05-16 10:00:52	Bernie Sanders is being treated very badly by the Dems. The system is rigged against him. He should run as an independent! Run Bernie, run.
Staff	2016-05-16 02:23:06	Great new poll- thank you! #MakeAmericaGreatAgain #Trump2016 https://t.co/SZyZ8GkF23
Trump	2016-05-16 01:25:54	The @washingtonpost report on potential VP candidates is wrong. Marco Rubio and most others mentioned are NOT under consideration.
Staff	2016-05-15 21:26:39	Thank you Georgia! See you soon! #Trump2016 https://t.co/8yFd6qA4rD
Trump	2016-05-15 19:26:45	The media is really on a witch-hunt against me. False reporting, and plenty of it - but we will prevail!
Trump	2016-05-15 19:11:30	Why did the failing @nytimes refuse to use any of the names given to them that I was so proud to have helped with their careers. DISHONEST!
Trump	2016-05-15 11:32:14	Why doesn't the failing @nytimes write the real story on the Clintons and women? The media is TOTALLY dishonest!
Trump	2016-05-15 11:16:01	"@TakingIt_Back:  @nytimes keep shining....the ppl will not let the media dim your light...we no longer believe them! #Trump2016" Thanks.
Trump	2016-05-15 11:14:59	"@tzard000: @realDonaldTrump @nytimes Everyone continues to pile onto Donald, but they can NEVER take away our votes!"  Thank you!
Trump	2016-05-15 11:13:17	Everyone is laughing at the @nytimes for the lame hit piece they did on me and women.I gave them many names of women I helped-refused to use
Trump	2016-05-15 11:02:27	"@MrTohNey: Leicester &amp; DonaldTrump seem to have the same trajectory, both were written off, but they keep scaling the heights. History?
Trump	2016-05-15 11:00:18	"@QueenCharlotteO: @realDonaldTrump @nytimes I'm a women &amp; I 100% support @realDonaldTrump &amp; I have since the beginning. Thank you!
Trump	2016-05-15 10:55:39	The failing @nytimes wrote yet another hit piece on me. All are impressed with how nicely I have treated women, they found nothing. A joke!
Trump	2016-05-15 10:49:31	Thank you for the nice words this morning @KellyRiddell. Well delivered and totally logical! @CNN   @FoxNews
Trump	2016-05-15 02:06:11	"@stranahan: Sheldon Adelson Pledges $100 Million to Elect Trump President - Breitbart https://t.co/aRXPHAlCLC"
Staff	2016-05-14 15:09:49	Great new poll- thank you! https://t.co/ytzesbCZas
Trump	2016-05-14 01:03:02	If Crooked Hillary Clinton can't close the deal on Crazy Bernie, how is she going to take on China, Russia, ISIS and all of the others?
Staff	2016-05-12 19:22:18	Great meeting with @SenateMajLdr Mitch McConnell and Republican leaders in D.C. #Trump2016 https://t.co/R0NuOrZISX
Staff	2016-05-12 18:12:38	Great day in D.C. with @SpeakerRyan and Republican leadership. Things working out really well! #Trump2016 https://t.co/hfHY9MdAc7
Trump	2016-05-11 20:51:20	In interview I told @AP that my taxes are under routine audit and I would release my tax returns when audit is complete, not after election!
Staff	2016-05-11 17:43:33	#MakeAmericaGreatAgain #Trump2016 https://t.co/CLhqgybbYR
Trump	2016-05-11 10:26:37	I don't want to hit Crazy Bernie Sanders too hard yet because I love watching what he is doing to Crooked Hillary. His time will come!
Trump	2016-05-11 10:22:54	Big wins in West Virginia and Nebraska. Get ready for November - Crooked Hillary, who is looking very bad against Crazy Bernie, will lose!
Staff	2016-05-11 01:04:26	Thank you Nebraska! #MakeAmericaGreatAgain #Trump2016 https://t.co/RRma61oisz
Staff	2016-05-11 00:05:31	Thank you West Virginia! #MakeAmericaGreatAgain #Trump2016 https://t.co/iCGcF21fWY
Staff	2016-05-10 15:20:24	WEST VIRGINIA #VoteTrump TODAY! #MakeAmericaGreatAgain #Trump2016 https://t.co/pndaZjsruy
Staff	2016-05-10 15:19:11	NEBRASKA #VoteTrump TODAY! #MakeAmericaGreatAgain #Trump2016 https://t.co/hGbesTbQci
Trump	2016-05-10 14:03:51	It is only the people that were never asked to be VP that tell the press that they will not take the position.
Trump	2016-05-10 13:57:33	It was Rosie O'Donnell who ate the cake in the vicious Hillary commercial about me, not Crooked Hillary! @marthamaccallum
Trump	2016-05-10 12:57:08	Why does the media, with a strong push from Crooked Hillary, keep pushing the false narrative that I want to raise taxes. Exactly opposite!
Trump	2016-05-10 11:31:57	. #RepMikeKelly  Great job on @foxandfriends this morning. Thank you for the nice words!
Trump	2016-05-10 10:27:51	Get out and vote Nebraska, we will MAKE AMERICA GREAT AGAIN!
Trump	2016-05-10 10:20:40	Get out and vote West Virginia, we will MAKE AMERICA GREAT AGAIN!
Trump	2016-05-10 02:15:41	"@RedRising11: ����I am a woman &amp; I JUST VOTED FOR @realDonaldTrump #NebraskaPrimary #Trump2016 #TrumpForPresident https://t.co/zgzwxQ92wZ"
Staff	2016-05-07 00:16:31	Crooked Hillary Clinton wants completely open borders. Millions of Democrats will run from her over this and support me.
Staff	2016-05-07 00:14:54	Just met with courageous family of Sarah Root in Nebraska. Sarah was horribly killed by illegal immigrant, but leaves behind amazing legacy.
Staff	2016-05-06 23:16:36	Goofy Elizabeth Warren, Hillary Clinton’s flunky, has a career that is totally based on a lie. She is not Native American.
Staff	2016-05-06 23:16:17	Let’s properly check goofy Elizabeth Warren’s records to see if she is Native American. I say she’s a fraud!
Staff	2016-05-06 23:15:58	I hope corrupt Hillary Clinton chooses goofy Elizabeth Warren as her running mate. I will defeat them both.
Staff	2016-05-06 21:01:44	Response to @LindseyGrahamSC: https://t.co/lSDE7LHc95
Staff	2016-05-06 18:25:27	I hear @JoeNBC of rapidly fading @Morning_Joe is pushing hard for a third party candidate to run. This will guarantee a Crooked Hillary win.
Staff	2016-05-06 18:03:34	Joe Scarborough initially endorsed Jeb Bush and Jeb crashed, then John Kasich and that didn't work. Not much power or insight!
Trump	2016-05-06 12:38:38	Crooked Hillary has ZERO leadership ability. As Bernie Sanders says, she has bad judgement. Constantly playing the women's card - it is sad!
Trump	2016-05-06 12:08:37	Paul Ryan said that I inherited something very special, the Republican Party. Wrong, I didn't inherit it, I won it with millions of voters!
Trump	2016-05-06 11:50:19	"@Ausbiz:  Many would say that you are the only talented person running for the top job this time! #MakeAmericaGreatAgain #TrumpTrain"
Trump	2016-05-06 10:26:43	So many great endorsements yesterday, except for Paul Ryan! We must put America first and MAKE AMERICA GREAT AGAIN!
Trump	2016-05-06 10:19:08	Governor Rick Perry said "Donald Trump is one of the most talented people running for the Presidency I've ever seen." Thank you Rick!
Trump	2016-05-06 10:14:56	Unlike crooked Hillary Clinton, who wants to destroy all miners, I want wages to go up in America. We will do so by bringing back jobs!
Staff	2016-05-06 03:19:09	Thank you West Virginia. Let's keep it going. Go out and vote on Tuesday - we will win big. #Trump2016
Staff	2016-05-06 01:57:05	Can you believe Crooked Hillary said, "We are going to put a whole lot of coal miners&amp;coal companies out of business." She then apologized.
Staff	2016-05-05 23:28:31	Join me tomorrow! #Trump2016  #MakeAmericaGreatAgain   Omaha, Nebraska: https://t.co/2OWQIlNutu  Eugene, Oregon: https://t.co/oroTbvsNdQ
Staff	2016-05-05 18:57:30	Happy #CincoDeMayo! The best taco bowls are made in Trump Tower Grill. I love Hispanics! https://t.co/ufoTeQd8yA https://t.co/k01Mc6CuDI
Staff	2016-05-04 16:31:05	Join me in Charleston, WV - tomorrow! https://t.co/kv624y9UOm
Trump	2016-05-04 10:12:54	I will be interviewed on @foxandfriends at 7:30 A.M. Enjoy!
Trump	2016-05-04 10:09:36	I will be interviewed on @TODAYshow and Good Morning America at 7:00 A.M.
Trump	2016-05-04 10:04:23	I will be interviewed on @Morning_Joe at 6:15 A.M. Enjoy!
Trump	2016-05-04 09:44:28	I would rather run against Crooked Hillary Clinton than Bernie Sanders and that will happen because the books are cooked against Bernie!
Trump	2016-05-04 09:25:10	What a great evening we had. So interesting that Sanders beat Crooked Hillary. The dysfunctional system is totally rigged against him!
Trump	2016-05-04 04:00:46	.@oreillyfactor  Please correct, I WON Virginia!
Staff	2016-05-03 23:14:30	Thank you Indiana! #Trump2016 #MakeAmericaGreatAgain https://t.co/G4JlShRA6I
Trump	2016-05-03 23:08:44	Lyin' Ted Cruz consistently said that he will, and must, win Indiana. If he doesn't he should drop out of the race-stop wasting time &amp; money
Trump	2016-05-03 23:02:55	Wow, Lyin' Ted Cruz really went wacko today. Made all sorts of crazy charges. Can't function under pressure - not very presidential. Sad!
Staff	2016-05-03 18:29:03	MAKE AMERICA GREAT AGAIN! #INPrimary #VoteTrump  https://t.co/TI27thMZEI
Staff	2016-05-03 16:50:10	Polls close at 6pm! #INPrimary #Trump2016 #VoteTrump  https://t.co/DT9WkYAGEK
Staff	2016-05-03 15:31:51	Thank you America! #Trump2016  https://t.co/tiExz8YhFT https://t.co/Hkt3YNccb0
Staff	2016-05-03 14:22:18	MAKE AMERICA GREAT AGAIN! #INPrimary #VoteTrump  https://t.co/MBgGXSYluW https://t.co/YPwDZ8Irch
Staff	2016-05-03 11:23:58	MAKE AMERICA GREAT AGAIN! #INPrimary #VoteTrump https://t.co/nMqeKxccv6
Staff	2016-05-02 22:24:06	Will be in South Bend, Indiana in a short while -- big rally! See you soon!
Staff	2016-05-02 21:56:36	Will be interviewed on @seanhannity tonight at 10pmE. Enjoy! #INPrimary
Staff	2016-05-02 21:50:17	THANK YOU AMERICA! #MakeAmericaGreatAgain https://t.co/PvhGP2HmbN
Staff	2016-05-02 21:42:54	Thank you Carmel, Indiana! Get out &amp; #VoteTrump tomorrow! #INPrimary #MakeAmericaGreatAgain https://t.co/j07c4oYryG
Staff	2016-05-02 19:57:55	Honored to have received the endorsement of Lou Holtz - a great guy! #INPrimary #Trump2016 https://t.co/AeGyODb37O
Staff	2016-05-02 16:16:14	I will defeat Crooked Hillary Clinton on 11/8/2016. #Trump2016 #MakeAmericaGreatAgain https://t.co/HtwD1FGn9e
Staff	2016-05-02 14:27:51	I will be campaigning in Indiana all day. Things are looking great, and the support of Bobby Knight has been so amazing. Today will be fun!
Trump	2016-05-02 14:06:30	Everybody is talking about the protesters burning the American flags and proudly waving Mexican flags. I want America First - so do voters!
Trump	2016-05-02 11:21:02	Gov Mike Pence has just stated that Donald Trump has taken a strong stance on Hoosier jobs, and he thanks me! I will bring back jobs to USA.
Trump	2016-05-02 11:12:40	Crooked Hillary Clinton said she is used to "dealing with men who get off the reservation." Actually, she has done poorly with such men!
Trump	2016-05-02 10:42:59	I will be interviewed on @CNN  @NewDay  at 7:30 A.M. Enjoy!
Staff	2016-05-01 23:37:17	Join me in Carmel, Indiana- tomorrow at 4pm! #INPrimary  https://t.co/tfW6B0eZDm https://t.co/ZiofZ2D6ck
Staff	2016-05-01 21:31:05	Thank you Fort Wayne, Indiana! #Trump2016 #INPrimary https://t.co/mDGrmMmk5T
Staff	2016-05-01 21:29:09	Thank you Terre Haute, Indiana! #MakeAmericaGreatAgain https://t.co/O6ELhlae3h
Staff	2016-05-01 20:06:16	.@KarlRove is a failed Jeb Bushy. Never says anything good &amp; never will, even after I beat Hillary. Shouldn't be on the air!
Staff	2016-05-01 16:29:26	I am on @FoxNewsSunday with Chris Wallace- his 20th year anniversary with #FNS, throughout the day. Enjoy! https://t.co/hDzdDpZiRx
Staff	2016-05-01 16:10:45	Will be in Terre Haute, Indiana in a short while -- big rally! See you soon!
Staff	2016-05-01 13:59:20	Thank you Indiana! #Trump2016 https://t.co/shPWexfkVX
Trump	2016-05-01 03:10:35	I will be in Indiana on Sunday and Monday at four MAKE AMERICA GREAT AGAIN rallies. See you there!
Trump	2016-04-30 23:33:19	Thank you @MikeOzanian for the nice comments on @FoxNews today. Great job!
Staff	2016-04-30 20:50:42	Trump locks down Delaware GOP delegates. #Trump2016 #MAGA  https://t.co/sto7CYV1fw
Trump	2016-04-30 17:21:35	The economy is bad and getting worse-almost ZERO growth this quarter. Nobody can beat me on the economy (and jobs). MAKE AMERICA GREAT AGAIN
Trump	2016-04-30 15:53:30	"@LexingtonBobby: @FoxNews @tedcruz @realDonaldTrump https://t.co/uhDlyi82Ua"
Trump	2016-04-30 13:31:13	The "protesters" in California were thugs and criminals. Many are professionals. They should be dealt with strongly by law enforcement!
Trump	2016-04-30 03:07:59	.@AC360  Anderson, so amazing. Your mother is, and always has been, an incredible woman!
Trump	2016-04-29 18:28:05	We are now at 1001 delegates. We will win on the first ballot and are not wasting time and effort on other ballots because system is rigged!
Staff	2016-04-29 16:04:46	Thank you Indiana! #Trump2016 https://t.co/WAuI0nRNzX
Trump	2016-04-29 13:46:49	Crooked Hillary Clinton, perhaps the most dishonest person to have ever run for the presidency, is also one of the all time great enablers!
Trump	2016-04-29 11:22:04	Wow, the ridiculous deal made between Lyin'Ted Cruz and 1 for 42 John Kasich has just blown up. What a dumb deal - dead on arrival!
Staff	2016-04-26 19:55:15	Thank you America! #Trump2016 https://t.co/KL7VZbM1jP
Staff	2016-04-26 18:12:15	Lets #MakeAmericaGreatAgain, Maryland! #VoteTrump  https://t.co/ZttNAmk1QS
Staff	2016-04-26 18:12:06	You have until 8pm to #VoteTrump, Delaware! https://t.co/GYeV6m1qOn
Staff	2016-04-26 18:05:25	Thank you for a great day yesterday, Rhode Island! #VoteTrump https://t.co/nAlgNIIdyo
Staff	2016-04-26 18:03:39	Six hours left to #VoteTrump Connecticut! https://t.co/U1kbLMwhNI
Staff	2016-04-26 18:02:10	Lets go Pennsylvania! #VoteTrump  https://t.co/TWQM8AV9p4
Staff	2016-04-26 16:18:18	Thank you for the incredible support- Melania, Barron, Ivanka, Jared, Tiffany, Don, Vanessa, Eric, and Lara! https://t.co/mPGpPFiDl8
Staff	2016-04-26 13:33:24	Thank you @DonaldJTrumpJr &amp; @EricTrump. #Trump2016  https://t.co/CMfcrZjHgM
