Trump	2016-06-26 16:06:23	Crooked Hillary just took a major ad of me playing golf at Turnberry. Shows me hitting shot, but I never did = lie! Was there to support son
Trump	2016-06-26 11:36:14	Clinton is trying to wash away her bad judgement call on BREXIT with big dollar ads. Disgraceful!
Trump	2016-06-26 03:32:05	Just landed in New York - a one night stay in Scotland. Turnberry came out magnificently. My son, Eric, did a great job - under budget!
Staff	2016-06-26 02:40:06	Obama has blocked ICE officers and BP from doing their jobs. That ends when I am President!
Staff	2016-06-26 02:37:59	We only want to admit those who love our people and support our values. #AmericaFirst
Staff	2016-06-26 02:37:14	We must suspend immigration from regions linked with terrorism until a proven vetting method is in place.
Staff	2016-06-25 16:00:18	Thank you to everyone who came out &amp; joined us @TrumpTurnberry yesterday! @EricTrump @IvankaTrump @DonaldJTrumpJr https://t.co/hQ1JTMrUtG
Staff	2016-06-25 15:07:32	On the 13th tee box @TrumpScotland with my grand daughter, Kai! @DonaldJTrumpJr https://t.co/7ii4KUfsab
Staff	2016-06-25 14:55:11	Arriving @TrumpScotland with @DonaldJTrumpJr &amp; @EricTrump. Back to New York tonight.  Video: https://t.co/2GUKqOTHS5
Trump	2016-06-25 12:00:29	So funny, Crooked Hillary called BREXIT so incorrectly, and now she says that she is the one to deal with the U.K. All talk, no action!
Staff	2016-06-25 04:29:41	Thoughts and prayers are with everyone in West Virginia- dealing with the devastating floods. #ImWithYou
Trump	2016-06-24 22:31:14	"@Jolena3: @realDonaldTrump And we will get it back once we have President Trump! Can't wait!"
Trump	2016-06-24 22:12:13	"@DarrenWaggener: @realDonaldTrump What has happened in the UK in the last 12 hours is exactly what will happen in November..vote TRUMP 2016
Trump	2016-06-24 21:43:17	Many people are equating BREXIT, and what is going on in Great Britain, with what is happening in the U.S. People want their country back!
Trump	2016-06-24 21:34:48	The opening of Trump Turnberry in Scotland was a big success. Good timing, I was here for BREXIT. Very exciting news conference today!
Staff	2016-06-23 17:07:28	Hillary Lies to Benghazi Families #CrookedHillary  https://t.co/YWd5lk5skG
Trump	2016-06-23 13:20:29	ISIS threatens us today because of the decisions Hillary Clinton has made along with President Obama."  --  Donald J. Trump
Trump	2016-06-23 13:13:22	Thank you to Donald Rumsfeld for the endorsement. Very much appreciated. Clinton's conduct has been "disqualifying."
Trump	2016-06-23 03:29:50	"@AllegrettiVicki: You have great children, future presidents...and we all see were raised right and out there for their father." Thank you.
Trump	2016-06-23 02:26:09	"@1lion: brilliant 3 word response to Hillary's 'I'm With You'  slogan https://t.co/dJL71jwK0g @realDonaldTrump https://t.co/Audi8h85qu"
Trump	2016-06-23 02:24:01	"@justininglv: @realDonaldTrump great speech today!! It's all about America and that's why you will become president!!!!"  Thank you.
Staff	2016-06-22 19:01:09	#Imwithyou https://t.co/iY4K7Wcw3C
Trump	2016-06-22 03:48:27	"@chrisboydbrew: @LouDobbs @realDonaldTrump @FoxBusiness.. Saw your interview.You are the best! Great questions, great answers" Lou is great
Trump	2016-06-22 03:16:27	Crooked Hillary refuses to say that she will be raising taxes beyond belief! She will be a disaster for jobs and the economy!
Trump	2016-06-21 16:55:41	I am "the king of debt."That has been great for me as a businessman, but is bad for the country. I made a fortune off of debt, will fix U.S.
Staff	2016-06-21 16:44:28	Hillary Clinton's open borders immigration policies will drive down wages for all Americans - and make everyone less safe.
Trump	2016-06-20 10:24:12	When I said that if, within the Orlando club, you had some people with guns, I was obviously talking about additional guards or employees
Trump	2016-06-20 01:22:16	.@DJohnsonPGA We are so proud of you Dustin. Your reaction under pressure was amazing. First of many Majors. You are a true CHAMPION!
Trump	2016-06-19 13:17:35	"@bfraser747: Watch out HillaryClinton �� Support @realDonaldTrump ���� ���� #MakeAmericaGreatAgain ���� https://t.co/UTYOLo7wGF"
Staff	2016-06-19 03:01:15	Yesterday's failing @NYTimes fraudulently shows an empty room prior to my speech, when in fact, it was packed! https://t.co/iFuf8MdTEH
Staff	2016-06-19 02:57:51	How can the NY Times show an empty room hours before my speech even started when they knew it was going to be packed? So totally dishonest!
Staff	2016-06-19 02:24:56	Donald Trump's Speech Is a Game Changer. #Trump2016 https://t.co/VXjtSivvuU https://t.co/dIK3IyrYGC
Staff	2016-06-19 01:28:32	See you soon Arizona! #Trump2016 https://t.co/W4z2eW5ay4
Staff	2016-06-19 01:10:55	I love you Arizona! Thank you! #Trump2016 #AmericaFirst https://t.co/QuTsSmeVdO
Staff	2016-06-18 20:08:18	MAKE AMERICA GREAT AGAIN! MAKE AMERICA SAFE AGAIN! #Trump2016 #AmericaFirst https://t.co/vN4K8FvQNT
Staff	2016-06-18 19:39:17	Thank you Las Vegas, Nevada! #Trump2016 #AmericaFirst  https://t.co/vhGwmhGCVR https://t.co/m1EIra7YMU
Trump	2016-06-18 17:51:08	In Las Vegas, getting ready to speak!
Staff	2016-06-18 17:22:31	Join me in Phoenix, Arizona today at 4pm! #Trump2016 #AmericaFirst https://t.co/PVB6QX7VpK https://t.co/hSaIurAfvD
Staff	2016-06-18 02:44:21	Thank you Houston, Texas!  #AmericaFirst #Trump2016  https://t.co/593p8uRPhq
Staff	2016-06-17 23:56:54	Thank you! #AmericaFirst  https://t.co/TZf8uwQO4L
Staff	2016-06-17 23:55:29	The convention in Cleveland will be amazing!  https://t.co/NlF2Gcr915
Staff	2016-06-17 21:14:59	Join me in Phoenix, Arizona tomorrow at 4pm! #Trump2016 #AmericaFirst https://t.co/PVB6QX7VpK https://t.co/B51r30Mazd
Staff	2016-06-17 17:07:23	THANK YOU! #AmericaFirst https://t.co/qp07UfnnjM
Trump	2016-06-17 11:24:04	MAKE AMERICA GREAT AGAIN! MAKE AMERICA SAFE AGAIN!
Trump	2016-06-17 11:20:36	People very unhappy with Crooked Hillary and Obama on JOBS and SAFETY! Biggest trade deficit in many years! More attacks will follow Orlando
Trump	2016-06-17 11:04:58	Amazing crowd last night in Dallas - more spirit and passion than ever before. Today, all over the great State of Texas!
Trump	2016-06-17 10:09:42	"@VoteTrumpMAGA: The media attack on @realDonaldTrump is relentless. They are desperate. But, they keep #Trump in the news - a good thing.
Staff	2016-06-17 02:16:21	Thank you Dallas, Texas!  https://t.co/ui9tSfMcS8 https://t.co/2iYArmM7oN
Staff	2016-06-16 20:38:38	Houston, TX: https://t.co/nvHRnfi2N7  Las Vegas, NV https://t.co/ksU8AGrFBS  Phoenix, AZ: https://t.co/PVB6QX7VpK https://t.co/2ToWwthEeF
Staff	2016-06-16 19:16:23	Join me in Houston, Texas tomorrow night at 7pm! Tickets: https://t.co/nvHRnfzEbH https://t.co/Yd3f8xLpPl
Staff	2016-06-16 16:59:00	"Donald Trumps Speech Is a Game Changer." https://t.co/VXjtSivvuU https://t.co/J777QHdYa3
Staff	2016-06-16 16:54:39	The trade deficit rose to a 7yr high thanks to horrible trade policies Clinton supports. I will fix it fast- JOBS! https://t.co/jaGeN4u50U
Trump	2016-06-16 02:36:46	"@realericjallen: @realDonaldTrump is a Common Sense Conservative! President Trump=Competence, Safety, Unity, &amp; US JOBS, JOBS, JOB.
Trump	2016-06-15 22:49:53	I will be interviewed on @greta at 7:00 P.M.  @FoxNews
Staff	2016-06-15 21:25:14	Finally an accurate story from the Washington Post! https://t.co/0nNKEBSd73
Staff	2016-06-15 20:04:47	Thank you Atlanta, Georgia! Will be back soon! #AmericaFirst https://t.co/cVJvfcoGOt
Trump	2016-06-15 13:50:31	I will be meeting with the NRA, who has endorsed me, about not allowing people on the terrorist watch list, or the no fly list, to buy guns.
Trump	2016-06-15 13:44:14	The press is so totally biased that we have no choice but to take our tough but fair and smart message directly to the people!
Trump	2016-06-15 13:38:17	An: Media fell all over themselves criticizing what DonaldTrump "may have insinuated about @POTUS." But he's right: https://t.co/bIIdYtvZYw
Staff	2016-06-15 02:40:32	Thank you Greensboro, North Carolina! Will be back soon! #AmericaFirst https://t.co/R29WMGNLGG
Staff	2016-06-14 18:28:48	TONIGHT! NORTH CAROLINA: https://t.co/UolRS3aT6W  WEDNESDAY! GEORGIA: https://t.co/1JJ2Kn0ani  SATURDAY! NEVADA: https://t.co/x3w1PHtLXP
Staff	2016-06-14 18:09:57	HAPPY 241st BIRTHDAY to the @USArmy! THANK YOU! https://t.co/mXsxkfcstC
Trump	2016-06-14 12:28:16	AMERICA FIRST!
Trump	2016-06-14 12:26:49	American must now get very tough, very smart and very vigilant. We cannot admit people into our country without extraordinary screening.
Staff	2016-06-14 00:20:57	Join me in Atlanta on Wednesday- at noon! #Trump2016 Tickets: https://t.co/1JJ2Kn0ani https://t.co/cyARlHSEFU
Staff	2016-06-13 21:35:30	Crooked Hillary says we must call on Saudi Arabia and other countries to stop funding hate. I am calling on- cont'd: https://t.co/T1fVcu3mEC
Staff	2016-06-13 21:32:44	Saudi Arabia and many of the countries that gave vast amounts of money to the Clinton Foundation- cont'd: https://t.co/t31ReRSzzy
Staff	2016-06-13 21:12:21	I thought people weren’t celebrating? They were cheering all over, even this savage from Orlando. I was right. https://t.co/DrVa65X9rI
Staff	2016-06-13 21:10:26	In my speech on protecting America I spoke about a temporary ban, which includes suspending immigration from nations tied to Islamic terror.
Staff	2016-06-13 20:38:59	Based on the incredibly inaccurate coverage and reporting of the record setting Trump campaign, we are hereby:  https://t.co/THKJwjNkaz
Staff	2016-06-13 20:35:11	I am no fan of President Obama, but to show you how dishonest the phony Washington Post is: https://t.co/cITm8BPixD
Staff	2016-06-11 18:21:15	Sad case- @USATODAY did article saying I don't pay bills- false, only don't pay when work is shoddy, bad, or not done! They should do same!
Trump	2016-06-11 11:18:19	Mitt Romney had his chance to beat a failed president but he choked like a dog. Now he calls me racist-but I am least racist person there is
Staff	2016-06-11 04:30:44	Thank you Richmond, Virginia!  #Trump2016 https://t.co/SxU4yzCLQf
Staff	2016-06-10 21:24:38	Thank you @FaithandFreedom Coalition! An honor joining you today- to discuss our shared values. #RTM2016 #Trump2016 https://t.co/Ye6IhOW6ZM
Staff	2016-06-10 20:39:41	Heading to Richmond, Virginia now. Join me tonight! #Trump2016 Tickets: https://t.co/I2CJSqiKGN
Staff	2016-06-10 16:12:13	2004 VIDEO: Pocahontas describing Crooked Hillary Clinton as a Corporate Donor Puppet. Time for change! #Trump2016  https://t.co/rZ1MqUzpKU
Trump	2016-06-10 15:55:55	Heading to D.C. to speak at Faith and Freedom Coalition and visit OPO.
Trump	2016-06-10 15:10:22	The great boxing promoter, Don King, just endorsed me. Nice!
Staff	2016-06-10 13:13:42	Join me!  6/10: Richmond, VA - 8pm 6/11: Tampa, FL - 11am 6/11: Pittsburgh, PA - 3pm 6/13: Portsmouth, NH - 2:30pm https://t.co/kv624y9UOm
Trump	2016-06-10 12:20:01	"@FoxNews: .@JamesRosenFNC: "Never before has a president endorsed someone under investigation by @TheJusticeDept." https://t.co/fX5bs8fzac
Trump	2016-06-10 12:07:49	Pocahontas is at it again! Goofy Elizabeth Warren, one of the least productive U.S. Senators, has a nasty mouth. Hope she is V.P. choice.
Trump	2016-06-10 02:31:06	"@FreemarketSara: Trump's Historic 13 Million Primary Votes - A Record ... Congratulations @realDonaldTrump https://t.co/zdOEle8wOL"
Staff	2016-06-10 02:29:27	Join me! #Trump2016  6/10: Richmond https://t.co/I2CJSqAlyl  6/11: Tampa https://t.co/6jk33orxXG  6/11: Pittsburgh https://t.co/bwgL1ZXtC7
Staff	2016-06-09 19:26:49	A message of condolences and support regarding the terrorist attacks in Tel Aviv:  https://t.co/iulXLEANei
Trump	2016-06-09 12:29:24	Crooked Hillary Clinton will be a disaster on jobs, the economy, trade, healthcare, the military, guns and just about all else. Obama plus!
Trump	2016-06-09 12:11:55	As expected, the media is very much against me. Their dishonesty is amazing but, just like our big wins in the primaries, we will win!
Trump	2016-06-09 01:49:25	"@KathyCeurter: @realDonaldTrump please Mr.Trump make @SenatorJeffSessions your VP. He is a perfect running mate."  He is a great guy!
Trump	2016-06-09 01:46:03	Bernie Sanders must really dislike Crooked Hillary after the way she played him. Many of his supporters, because of trade, will come to me.
Trump	2016-06-09 01:00:03	"@mabynshingleton: JohnKasich, the VOTERS have spoken.We want @realDonaldTrump. You AGREED to support NOMINEE. Get on board or leave @GOP"
Trump	2016-06-09 00:56:58	"@Dale_Dangler: @realDonaldTrump You will be the greatest president the world has ever seen"  Thanks.
Trump	2016-06-09 00:54:44	I would have had many millions of votes more than Crooked Hillary Clinton except for the fact that I had 16 opponents, she had one!
Trump	2016-06-09 00:49:22	"@nauthizjane: @realDonaldTrump Congratulations Mr. Trump."  Thank you!
Trump	2016-06-09 00:49:01	"@setfire2flames: Senator Sanders spent more than @realDonaldTrump yet lost."
Staff	2016-06-08 20:27:28	MAKE AMERICA GREAT AGAIN! #AmericaFirst #Trump2016  https://t.co/42OpVsjXjp
Trump	2016-06-08 12:44:26	"@lovusa4: @RichardWeaving Why @foxandfriends @NewDay WHERE IS THE REPORTING @realDonaldTrump &lt;MOST VOTES FOR PRESIDENT IN HISTORY OF USA"
Trump	2016-06-08 12:14:32	"@mariadaq:  HISTORIC!! what's historic is OUR national debt, record unemployment, &amp;pocketbook crisis!THE PEOPLE NEED TRUMP2 make USA RICH!"
Trump	2016-06-08 12:13:39	"@sara_wejesa: @realDonaldTrump Great speach!!!!!!!"  Thanks!
Trump	2016-06-08 12:11:52	"@jimhewitt: . @FrankCaliendo doing @realDonaldTrump on @MikeAndMike is awesome. "Number one presidency of all time"
Trump	2016-06-08 12:10:17	"@JoeDeFranco: Top RINO hack for MSNBC Joey Scarborough on the air and calling the next President Trump a racist and bigot. Shame on you"
Trump	2016-06-08 12:08:55	Nobody is watching @Morning_Joe anymore. Gone off the deep end - bad ratings. You won't believe what I am watching now!
Trump	2016-06-08 12:00:55	"@southpaw816: @SenSanders fans, greatest way to get even with her Highness - vote for @realDonaldTrump, at least you'll have a job.
Trump	2016-06-08 11:52:13	Thank you to all for your wonderful comments on my speech. I could feel the electricity in thr air. Great reviews - most votes ever recieved
Trump	2016-06-08 11:45:33	"@WolfStopper: Gee ... Does this make @realDonaldTrump right one more time? https://t.co/zjWKGMDgzi"
Trump	2016-06-08 11:43:19	"@DjD_Thunder: Standing by @realDonaldTrump all the way to the White House! https://t.co/z4X1o5xHBh"
Staff	2016-06-08 03:59:25	Thank you California! #Trump2016  https://t.co/GusL2UPrX2 https://t.co/H6D25S1TR5
Staff	2016-06-08 03:39:37	Thank you New Mexico! #Trump2016 https://t.co/wNOY8Pc2kM https://t.co/osWzVxNkJx
Staff	2016-06-08 03:32:02	Thank you South Dakota! #Trump2016  https://t.co/GbRTQdxIj4 https://t.co/pNqwOrY0ZB
Staff	2016-06-08 03:21:44	Thank you New Jersey! #Trump2016 https://t.co/PgIYkHLGtI https://t.co/MyJMOKdpJ9
Trump	2016-06-07 23:52:38	I will be interviewed tonight on @seanhannity - Enjoy!  10:00 P.M.
Staff	2016-06-07 22:45:26	Thank you! Together we will #MakeAmericaGreatAgain! https://t.co/7Jk6voyzue
Trump	2016-06-07 02:21:08	In just out book, Secret Service Agent Gary Byrne doesn't believe that Crooked Hillary has the temperament or integrity to be the president!
Trump	2016-06-07 01:51:12	A former Secret Service Agent for President Clinton excoriates Crooked Hillary describing her as ERRATIC &amp; VIOLENT. Bad temperament for pres
Staff	2016-06-06 14:29:47	Remembering the fallen heroes on #DDay - June 6, 1944. https://t.co/od7vsDMlHY
Trump	2016-06-06 13:42:53	A massive blow to Obama's message - only 38,000 new jobs for month in just issued jobs report. That's REALLY bad!
Trump	2016-06-06 13:23:54	Crooked Hillary is being badly criticized (for a Wall Street paid for ad) by PolitiFact for a false ad on me on women. She is a total fraud!
Trump	2016-06-06 12:56:07	Just like I have been able to spend far less money than  others on the campaign and finish #1, so too should our country. We can be great!
Trump	2016-06-06 11:23:54	People like @KatyTurNBC report on my campaign, but have zero access. They say what they want without any knowledge.True of so much of media!
Trump	2016-06-05 22:15:01	Hillary Clinton is unfit to be president. She has bad judgement, poor leadership skills and a very bad and destructive track record. Change!
Trump	2016-06-05 21:56:01	I am watching @CNN very little lately because they are so biased against me. Shows are predictable garbage! CNN and MSM is one big lie!
Trump	2016-06-05 21:36:48	The Clinton News Network, sometimes referred to as @CNN, is getting more and more biased.They act so indignant-hear them behind closed doors
Trump	2016-06-04 23:49:35	"@sareed59:  Our ineffective #POTUS has to make a speech in #Elkhart to make everything look great. Mr. Trump #MakeAmericaGreatAgain"
Staff	2016-06-04 21:24:13	Thank you Attorney General Gonzales, so many people feel this way.  https://t.co/fMR8YYiiMz
Trump	2016-06-04 13:14:26	We just had the worst jobs report since 2010.
Trump	2016-06-04 13:11:09	The Mayor of San Jose did a terrible job of ordering the  protection of innocent people. The thugs were lucky supporters remained peaceful!
Trump	2016-06-04 13:04:33	Many of the thugs that attacked the peaceful Trump supporters in San Jose were illegals. They burned the American flag and laughed at police
Trump	2016-06-04 12:49:18	"@Don_Vito_08: Thank You Mr. Trump for Standing up for Our Country! #VoteTrump2016 JOIN ME ON THE #TrumpTrain�� https://t.co/zgopGvSEen"
Trump	2016-06-04 12:47:47	"@rapidcraft: Here’s The HILLARY UNIVERSITY Scandal No One In The Media Is Talking About https://t.co/suHERIUHo4 @realDonaldTrump"
Trump	2016-06-04 04:29:03	Muhammad Ali is dead at 74! A truly great champion and a wonderful guy. He will be missed by all!
Staff	2016-06-03 22:20:52	Thank you Redding, California! #MakeAmericaGreatAgain #CAPrimary https://t.co/nFiydpTpPn
Staff	2016-06-03 16:01:47	"I'm a former chief of police in a border town. I'm Hispanic, I'm proud to be Hispanic and I'm 100% behind Trump." https://t.co/8YtBU7j17m
Trump	2016-06-02 17:06:29	Crooked Hillary Clinton, who I would love to call Lyin' Hillary, is getting ready to totally misrepresent my foreign policy positions.
Trump	2016-06-02 17:02:38	After the litigation is disposed of and the case won, I have instructed my execs to open Trump U(?), so much interest in it! I will be pres.
Trump	2016-06-02 16:54:21	Even though I have a very biased and unfair judge in the Trump U civil case in San Diego, I have thousands of great reviews &amp; will win case!
Trump	2016-06-02 16:48:50	With all of the Crooked Hillary Clinton's foreign policy experience, she has made so many mistakes - and I mean real monsters! No more HRC.
Trump	2016-06-02 16:31:52	Wow, USA Today did todays cover story on my record in lawsuits. Verdict: 450 wins, 38 losses. Isn't that what you want for your president?
Trump	2016-06-02 15:57:14	Do you ever notice that @CNN gives me very little proper representation on my policies. Just watched-nobody knew anything about my foreign P
Trump	2016-06-02 15:10:22	Bernie Sanders was right when he said that Crooked Hillary Clinton was not qualified to be president because she suffers from BAD judgement!
Trump	2016-06-02 15:03:21	Crooked Hillary Clinton has zero natural talent - she should not be president. Her temperament is bad and her decision making ability-zilch!
Trump	2016-06-02 05:12:45	"@HaloDad22: @realDonaldTrump I already voted for you! My wife did as well! I represent #Teachers4Trump! We represent #CA4Trump! #NeverDems
Trump	2016-06-02 05:11:16	"@SCPioneer: @stockdaleism @JamesRosenFNC @FoxNews @realDonaldTrump Not for slackers! Happy w/courses I took." Thanks.
Staff	2016-06-02 04:58:34	Thank you Sacramento, California! #MakeAmericaGreatAgain https://t.co/t75Zxn9L6f
Staff	2016-06-02 00:21:01	Same failing @nytimes "reporter" who wrote discredited women's story last week wrote another terrible story on me today- will never learn!
Trump	2016-06-01 22:16:36	Crooked Hillary Clinton is a fraud who has put the public and country at risk by her illegal and very stupid use of e-mails. Many missing!
Staff	2016-06-01 20:46:38	Join me in San Jose, California- tomorrow evening at 7pm!  #MakeAmericaGreatAgain #Trump2016 https://t.co/jLQukR550J https://t.co/Uds8OdH3A4
Trump	2016-06-01 13:17:58	So I raised/gave $5,600,000 for the veterans and the media makes me look bad! They do anything to belittle - totally biased.
Staff	2016-05-31 23:17:33	I am getting great credit for my press conference today. Crooked Hillary should be admonished for not having a press conference in 179 days.
Staff	2016-05-31 22:51:56	I will be interviewed on @seanhannity tonight at 10pmE on @FoxNews. Enjoy!
Staff	2016-05-31 21:12:07	Join me in Sacramento, California-tomorrow evening @ 7pm! #Trump2016 https://t.co/W7xy7eXcii https://t.co/km0rRYSDnO
Trump	2016-05-31 16:57:17	So many veterans groups are beyond happy with all of the money I raised/gave! It was my great honor - they do an amazing job.
Trump	2016-05-31 16:53:58	Just finished a press conference in Trump Tower wherein I gave information on which VETERANS groups got the $5,600,000 that I raised/gave!
Trump	2016-05-31 11:42:20	I have raised/given a tremendous amount of money to our great VETERANS, and have got nothing but bad publicity for doing so. Watch!
Trump	2016-05-31 10:48:49	So many great things happening - new poll numbers looking good! News conference at 11:00 A.M. today, Trump Tower!
Trump	2016-05-30 21:55:41	I should have easily won the Trump University case on summary judgement but have a judge, Gonzalo Curiel, who is totally biased against me.
Trump	2016-05-30 21:45:09	I have a judge in the Trump University civil case, Gonzalo Curiel (San Diego), who is very unfair. An Obama pick. Totally biased-hates Trump
Trump	2016-05-30 20:15:04	I hope everyone had a great Memorial Day!
Trump	2016-05-30 20:13:17	I would have had millions of votes more in the primaries (than Crooked Hillary) if I only had one opponent, instead of sixteen. Broke record
Trump	2016-05-30 11:26:47	Have a great Memorial Day and remember that we will soon MAKE AMERICA GREAT AGAIN!
Trump	2016-05-30 11:20:38	"@NBCDFW: Trump rallies veterans at annual Rolling Thunder Gathering https://t.co/b08FcMlgkr https://t.co/RCDeLvHQqD"
Trump	2016-05-30 11:19:29	"@MariaErnandez3b: Trump Supports Rolling Thunder Rally #TRUMP STRONG https://t.co/pfVXQ8NdZu" So true, and remember the M.I.A.'s!
Trump	2016-05-30 11:17:04	"@ScottWRasmussen: Donald Trump and Bikers Share Affection at Rolling Thunder Rally https://t.co/ZZl2sc29dn" A great day in D.C.!
Trump	2016-05-30 11:10:12	"@TeaPartyNevada: #Trump2016 "Illegals are taken care of better than our veterans."  https://t.co/KKIgM4rNma https://t.co/1cEZ8wG7Cy"
Trump	2016-05-30 11:05:34	The endorsement of me by the 16,500 Border Patrol Agents was the first time that they ever endorsed a presidential candidate. Nice!
Trump	2016-05-30 11:00:47	In getting the endorsement of the 16,500 Border Patrol Agents (thank you), the statement was made that the WALL was very necessary!
Trump	2016-05-30 10:41:49	Obama says a WALL at our southern border won't enhance our security (wrong) and yet he now wants to build a much bigger wall (fence) at W.H.
Staff	2016-05-29 23:02:01	If dummy Bill Kristol actually does get a spoiler to run as an Independent, say good bye to the Supreme Court!
Trump	2016-05-29 22:58:27	The Republican Party has to be smart &amp; strong if it wants to win in November. Can't allow lightweights to set up a spoiler Indie candidate!
Staff	2016-05-29 22:53:16	Bill Kristol has been wrong for 2yrs-an embarrassed loser, but if the GOP can't control their own, then they are not a party. Be tough, R's!
Staff	2016-05-29 21:43:15	Good news is that my campaign has perhaps more cash than any campaign in the history of politics- b/c I stand 100% behind everything we do.
Trump	2016-05-29 16:45:44	Heading to D.C. to see and hear ROLLING THUNDER. Amazing people that LOVE OUR COUNTRY. Great spirit!
Staff	2016-05-28 21:34:55	Does President Obama ever discuss the sneak attack on Pearl Harbor while he's in Japan? Thousands of American lives lost. #MDW
Staff	2016-05-28 21:33:58	Don't believe the biased and phony media quoting people who work for my campaign. The only quote that matters is a quote from me!
Staff	2016-05-28 20:28:48	I am always on the front page of the failing @nytimes, but when I won the GOP nomination, I'm in the back of the paper. Very dishonest!
Staff	2016-05-28 20:28:40	The media is on a new phony kick about my management style. I spend much less money &amp; get much better results! What we need as Prez!
Staff	2016-05-28 20:28:22	The failing @nytimes wrote a story about my management style &amp; that I don't have many people. I have 73, Hillary has 800- &amp; I'm beating her.
Trump	2016-05-28 13:47:10	The U.S. has 69 treaties with other countries where we would have to defend them and their borders. How nice, but what do we get? NOT ENOUGH
Staff	2016-05-28 06:19:54	Great rally in Fresno, California- great crowd! Thank you! #Trump2016 https://t.co/TVSPvxOmve
Staff	2016-05-28 04:13:54	Obama administration fails to screen Syrian refugees' social media accounts: https://t.co/MMa07nwa44
Staff	2016-05-28 02:48:22	.@SanDiegoPD- Fantastic job on handling the thugs who tried to disrupt our very peaceful and well attended rally. Greatly appreciated!
Staff	2016-05-28 02:19:19	Thank you @BillyJoel- many friends just told me you gave a very kind shoutout at MSG. Appreciate it- love your music!
Staff	2016-05-27 23:20:01	Wow- 25,000 in San Diego, California! Thank you!! #Trump2016 https://t.co/1NRj3zCuui
Trump	2016-05-27 23:19:20	I am on @oreillyfactor tonight, a big special. @FoxNews  at 8:00 P.M. ENJOY!
